{
  "schema_version": "animation-trace-v0.1",
  "case_id": "mock_lesson_001",
  "lesson_id": "mock_lesson_001",
  "generated_at": null,
  "events": [
    {
      "event_id": "mock-lesson-001-seg-001-evt-001",
      "slide": 1,
      "target": "mock-lesson-001-seg-001-el-001",
      "target_resolved": true,
      "executed": true,
      "effect_realized": true,
      "status": "executed",
      "planned": {
        "effect": "fadeIn",
        "trigger": "show",
        "start_ms": 0,
        "duration_ms": 600,
        "easing": "ease-out"
      },
      "actual": {
        "effect": "fadeIn",
        "trigger": "show",
        "start_ms": 42,
        "duration_ms": 600,
        "easing": "ease-out"
      },
      "fallback": null,
      "error_code": null,
      "message": null
    },
    {
      "event_id": "mock-lesson-001-seg-001-evt-002",
      "slide": 1,
      "target": "mock-lesson-001-seg-001-el-002",
      "target_resolved": true,
      "executed": true,
      "effect_realized": true,
      "status": "executed",
      "planned": {
        "effect": "fadeIn",
        "trigger": "show",
        "start_ms": 4200,
        "duration_ms": 600,
        "easing": "ease-out"
      },
      "actual": {
        "effect": "fadeIn",
        "trigger": "show",
        "start_ms": 4258,
        "duration_ms": 600,
        "easing": "ease-out"
      },
      "fallback": null,
      "error_code": null,
      "message": null
    }
  ],
  "runtime_errors": [],
  "metadata": {
    "fact_status": "MOCK_RUNTIME_EVIDENCE_NOT_RENDERED_VISIBILITY"
  }
}
